{
  "as_of": "2026-05-21",
  "source_run_id": "local",
  "bronze_max_trading_date": "2026-05-21",
  "tickers": [
    {
      "ticker": "ABEV3.SA",
      "return_ytd": 0.004910993534615863,
      "vol_annual": 0.105576980205787,
      "max_drawdown": -0.034461564284104566,
      "sharpe_vs_cdi": -0.5673693211418863,
      "last_close": 16.329999923706055,
      "last_close_date": "2026-05-21",
      "company_name": "Ambev S.A.",
      "sector_b3": "Consumo N\u00e3o C\u00edclico"
    },
    {
      "ticker": "ALOS3.SA",
      "return_ytd": -0.04364509786476853,
      "vol_annual": 0.17629842152301672,
      "max_drawdown": -0.05838930775833019,
      "sharpe_vs_cdi": -3.0092255686869755,
      "last_close": 28.229999542236328,
      "last_close_date": "2026-05-21",
      "company_name": "Allos S.A.",
      "sector_b3": "Consumo N\u00e3o C\u00edclico"
    },
    {
      "ticker": "ALPA4.SA",
      "return_ytd": 0.05024472337014001,
      "vol_annual": 0.24049775505321405,
      "max_drawdown": -0.028820954515564674,
      "sharpe_vs_cdi": 1.5779245786901894,
      "last_close": 12.039999961853027,
      "last_close_date": "2026-05-21",
      "company_name": "Alpargatas S.A.",
      "sector_b3": "Consumo C\u00edclico"
    },
    {
      "ticker": "ASAI3.SA",
      "return_ytd": -0.057421053117083364,
      "vol_annual": 0.2814571484891484,
      "max_drawdown": -0.08928573519295567,
      "sharpe_vs_cdi": -2.359302360560644,
      "last_close": 8.460000038146973,
      "last_close_date": "2026-05-21",
      "company_name": "Sendas Distribuidora",
      "sector_b3": "Consumo N\u00e3o C\u00edclico"
    },
    {
      "ticker": "B3SA3.SA",
      "return_ytd": -0.05012707978727515,
      "vol_annual": 0.2807636724861377,
      "max_drawdown": -0.09664580980774055,
      "sharpe_vs_cdi": -2.113332810335086,
      "last_close": 16.729999542236328,
      "last_close_date": "2026-05-21",
      "company_name": "B3 S.A. - Brasil Bolsa Balc\u00e3o",
      "sector_b3": "Financeiro"
    },
    {
      "ticker": "BBAS3.SA",
      "return_ytd": -0.03881232997981254,
      "vol_annual": 0.1256237796044612,
      "max_drawdown": -0.0608171456644037,
      "sharpe_vs_cdi": -3.8502347719726093,
      "last_close": 20.719999313354492,
      "last_close_date": "2026-05-21",
      "company_name": "Banco do Brasil",
      "sector_b3": "Financeiro"
    },
    {
      "ticker": "BBDC4.SA",
      "return_ytd": -0.01447688024605001,
      "vol_annual": 0.12244295534775267,
      "max_drawdown": -0.03869545367799864,
      "sharpe_vs_cdi": -2.0239169911048367,
      "last_close": 17.829999923706055,
      "last_close_date": "2026-05-21",
      "company_name": "Bradesco PN",
      "sector_b3": "Financeiro"
    },
    {
      "ticker": "BBSE3.SA",
      "return_ytd": 0.00899734335361315,
      "vol_annual": 0.0954860632166989,
      "max_drawdown": -0.016531313874467914,
      "sharpe_vs_cdi": -0.21254389509580152,
      "last_close": 34.61000061035156,
      "last_close_date": "2026-05-21",
      "company_name": "BB Seguridade",
      "sector_b3": "Financeiro"
    },
    {
      "ticker": "BPAC11.SA",
      "return_ytd": -0.06210702942936142,
      "vol_annual": 0.16233182941653435,
      "max_drawdown": -0.06894737377501371,
      "sharpe_vs_cdi": -4.370433337901626,
      "last_close": 53.529998779296875,
      "last_close_date": "2026-05-21",
      "company_name": "BTG Pactual",
      "sector_b3": "Financeiro"
    },
    {
      "ticker": "BRAV3.SA",
      "return_ytd": 0.1488516698226294,
      "vol_annual": 0.22740023251696764,
      "max_drawdown": -0.021387576723023827,
      "sharpe_vs_cdi": 5.871657076406414,
      "last_close": 20.389999389648438,
      "last_close_date": "2026-05-21",
      "company_name": "3R Petroleum",
      "sector_b3": "Petr\u00f3leo G\u00e1s e Biocombust\u00edveis"
    },
    {
      "ticker": "BRKM5.SA",
      "return_ytd": 0.26570318646505636,
      "vol_annual": 0.803999162167237,
      "max_drawdown": -0.0330378607939796,
      "sharpe_vs_cdi": 3.069377623968988,
      "last_close": 12.0,
      "last_close_date": "2026-05-21",
      "company_name": "Braskem",
      "sector_b3": "Materiais B\u00e1sicos"
    },
    {
      "ticker": "CMIG4.SA",
      "return_ytd": -0.03976323588026223,
      "vol_annual": 0.1574576810427098,
      "max_drawdown": -0.04661018490209119,
      "sharpe_vs_cdi": -3.1303491435239166,
      "last_close": 11.34000015258789,
      "last_close_date": "2026-05-21",
      "company_name": "Cemig PN",
      "sector_b3": "Utilidade P\u00fablica"
    },
    {
      "ticker": "CSAN3.SA",
      "return_ytd": -0.13324397471653177,
      "vol_annual": 0.34312052139000454,
      "max_drawdown": -0.16901402640066124,
      "sharpe_vs_cdi": -4.077114348717719,
      "last_close": 4.349999904632568,
      "last_close_date": "2026-05-21",
      "company_name": "Cosan S.A.",
      "sector_b3": "Petr\u00f3leo G\u00e1s e Biocombust\u00edveis"
    },
    {
      "ticker": "CSNA3.SA",
      "return_ytd": -0.08755588402600492,
      "vol_annual": 0.30910219801058453,
      "max_drawdown": -0.11676643009213736,
      "sharpe_vs_cdi": -3.0932118063402076,
      "last_close": 6.119999885559082,
      "last_close_date": "2026-05-21",
      "company_name": "Companhia Sider\u00fargica Nacional",
      "sector_b3": "Materiais B\u00e1sicos"
    },
    {
      "ticker": "CVCB3.SA",
      "return_ytd": -0.19811385448003666,
      "vol_annual": 0.395618944798239,
      "max_drawdown": -0.1797235443282749,
      "sharpe_vs_cdi": -5.1253370506907325,
      "last_close": 1.7799999713897705,
      "last_close_date": "2026-05-21",
      "company_name": "CVC Brasil",
      "sector_b3": "Consumo C\u00edclico"
    },
    {
      "ticker": "CYRE3.SA",
      "return_ytd": -0.002749748027699568,
      "vol_annual": 0.1536370668509002,
      "max_drawdown": -0.036903677775155866,
      "sharpe_vs_cdi": -0.8731708220580076,
      "last_close": 21.790000915527344,
      "last_close_date": "2026-05-21",
      "company_name": "Cyrela Realty",
      "sector_b3": "Consumo C\u00edclico"
    },
    {
      "ticker": "ENEV3.SA",
      "return_ytd": -0.07767878675274921,
      "vol_annual": 0.21859787626545604,
      "max_drawdown": -0.09529152177125116,
      "sharpe_vs_cdi": -3.9359334915403474,
      "last_close": 24.760000228881836,
      "last_close_date": "2026-05-21",
      "company_name": "Eneva",
      "sector_b3": "Utilidade P\u00fablica"
    },
    {
      "ticker": "ENGI11.SA",
      "return_ytd": -0.07577253421099807,
      "vol_annual": 0.15339820884740576,
      "max_drawdown": -0.08069498777492608,
      "sharpe_vs_cdi": -5.488399913693933,
      "last_close": 48.02000045776367,
      "last_close_date": "2026-05-21",
      "company_name": "Energisa",
      "sector_b3": "Utilidade P\u00fablica"
    },
    {
      "ticker": "EQTL3.SA",
      "return_ytd": -0.09784225510887583,
      "vol_annual": 0.17584097983014949,
      "max_drawdown": -0.09320806573259872,
      "sharpe_vs_cdi": -6.004386706923131,
      "last_close": 37.650001525878906,
      "last_close_date": "2026-05-21",
      "company_name": "Equatorial Energia",
      "sector_b3": "Utilidade P\u00fablica"
    },
    {
      "ticker": "EZTC3.SA",
      "return_ytd": 0.0246249447383156,
      "vol_annual": 0.24705441725365676,
      "max_drawdown": -0.05034903070524984,
      "sharpe_vs_cdi": 0.5309459461117441,
      "last_close": 13.109999656677246,
      "last_close_date": "2026-05-21",
      "company_name": "EZ Tec",
      "sector_b3": "Consumo C\u00edclico"
    },
    {
      "ticker": "FLRY3.SA",
      "return_ytd": -0.05406726017987695,
      "vol_annual": 0.16420797975196422,
      "max_drawdown": -0.062423528043977806,
      "sharpe_vs_cdi": -3.845955127743231,
      "last_close": 15.479999542236328,
      "last_close_date": "2026-05-21",
      "company_name": "Fleury",
      "sector_b3": "Sa\u00fade"
    },
    {
      "ticker": "GGBR4.SA",
      "return_ytd": -0.008900347142785495,
      "vol_annual": 0.09075336793304468,
      "max_drawdown": -0.023748917207560703,
      "sharpe_vs_cdi": -2.135071209910171,
      "last_close": 23.309999465942383,
      "last_close_date": "2026-05-21",
      "company_name": "Gerdau PN",
      "sector_b3": "Materiais B\u00e1sicos"
    },
    {
      "ticker": "GOAU4.SA",
      "return_ytd": -0.014489486413096416,
      "vol_annual": 0.11663216606826701,
      "max_drawdown": -0.028922076009974068,
      "sharpe_vs_cdi": -2.125799159677109,
      "last_close": 10.170000076293945,
      "last_close_date": "2026-05-21",
      "company_name": "Metal\u00fargica Gerdau PN",
      "sector_b3": "Materiais B\u00e1sicos"
    },
    {
      "ticker": "HAPV3.SA",
      "return_ytd": 0.1021210510827995,
      "vol_annual": 0.43041041865088153,
      "max_drawdown": -0.06108600344157033,
      "sharpe_vs_cdi": 2.049877537169967,
      "last_close": 12.670000076293945,
      "last_close_date": "2026-05-21",
      "company_name": "Hapvida",
      "sector_b3": "Sa\u00fade"
    },
    {
      "ticker": "HYPE3.SA",
      "return_ytd": -0.04753457211334224,
      "vol_annual": 0.23058227602431966,
      "max_drawdown": -0.06686540568282676,
      "sharpe_vs_cdi": -2.464281768494521,
      "last_close": 22.389999389648438,
      "last_close_date": "2026-05-21",
      "company_name": "Hypera",
      "sector_b3": "Sa\u00fade"
    },
    {
      "ticker": "ITSA4.SA",
      "return_ytd": -0.019048194970694474,
      "vol_annual": 0.15264307192360435,
      "max_drawdown": -0.04452831340285967,
      "sharpe_vs_cdi": -1.9137518850855006,
      "last_close": 13.0,
      "last_close_date": "2026-05-21",
      "company_name": "Ita\u00fasa PN",
      "sector_b3": "Financeiro"
    },
    {
      "ticker": "ITUB4.SA",
      "return_ytd": -0.009216723417820196,
      "vol_annual": 0.13735973533297324,
      "max_drawdown": -0.040099076371180604,
      "sharpe_vs_cdi": -1.4329622782343978,
      "last_close": 39.959999084472656,